{
  "schema_version": "1.0.0",
  "trade_id": "DF-2026-0007",
  "version": 1,
  "ticker": "XYZ",
  "setup": "catalyst_breakout",
  "instrument": "stock",
  "entry_price": 84.5,
  "stop": 80.75,
  "target": 91.0,
  "exit_price": 90.2,
  "exit_reason": "human_tighten",
  "initial_risk": 641.25,
  "net_pnl": 974.7,
  "r_multiple": 1.52,
  "mae_r": -0.31,
  "mfe_r": 1.66,
  "hold_sessions": 3,
  "regime_at_entry": "normal",
  "fill_type": "hypothetical",
  "mistake": "none",
  "would_repeat": "yes",
  "why_entered": "Primary supply-agreement catalyst with a breakout through 84.20 on 2.4x volume.",
  "what_happened": "Price held the breakout, reached 1.66R, and was flattened by a human tighten into the close of session 3.",
  "what_was_right": "Catalyst was real and the breakout held above the trigger level.",
  "what_was_wrong": "The target at 91 was not tagged. The exit was discretionary tightening, which is allowed, and it left 0.14R on the table versus the high.",
  "lesson": "Keep the original target unless a pre-listed invalidation fires. Early tightening is a human right, and the journal has to say so."
}
